,id,Description,forum_id
1759,1759,Though the reproduction of the results of latent disentanglement using the dSprites dataset is included in the scope of the reproducibility they have not performed these tests,mXpKOalTtN8
1760,1760,"In summary, though the authors have made a significant effort and shown the difficulties in reproducing the results of the original paper,  I believe that this report could use a lot of improvement",mXpKOalTtN8
1761,1761,"The original paper was difficult to reproduce because of the lack of certain parts of the code and poor documentation, however, the authors did a good job in reproducing and verifying various claims",mXpKOalTtN8
1762,1762,"As per the results, the quantitative values reported here are lower than expected",mXpKOalTtN8
1763,1763,The paper is very well written,mXpKOalTtN8
1764,1764,What is lacking is a thorough hyperparameter exploration,mXpKOalTtN8
1765,1765, ,mXpKOalTtN8
1766,1766,The authors provide a very nice summary and concrete that is being elaborated in the document,mXpKOalTtN8
1767,1767,They cover fully the reproducibility of the paper in terms of scope where they reused the original author's code,mXpKOalTtN8
1768,1768,It would be interesting to perform a hyperparameter search in order to verify the claims of the authors and maybe find new hyperparameters not experimented with the authors,mXpKOalTtN8
1769,1769,"In general, the report is well written and has a clear structure so I recommend it for being accepted",mXpKOalTtN8
1770,1770,*Scope of reproducibility:*,-rn9m0Gt6AQ
1771,1771,"The authors clearly state the scope of their experiments (reproducing the embedding experiment, restricted-self attention with BERT and the sequence-to-sequence experiments), and cleanly execute on them",-rn9m0Gt6AQ
1772,1772,*Code:*,-rn9m0Gt6AQ
1773,1773," In some instances, the authors re-used code from the original authors, and in some instances, they wrote their own",-rn9m0Gt6AQ
1774,1774,I did not see a reference to the code written for this paper,-rn9m0Gt6AQ
1775,1775,*Communication with original authors:*,-rn9m0Gt6AQ
1776,1776,The paper authors reach out to the original authors,-rn9m0Gt6AQ
1777,1777,"It looks like a good discussion took place, and the original authors were helpful in clarifying some of the ambiguities that arose through the paper (and also in providing code + datasets)",-rn9m0Gt6AQ
1778,1778,*Hyperparameter Search:*,-rn9m0Gt6AQ
1779,1779,Neither the replication study nor the original paper used a hyperparameter search,-rn9m0Gt6AQ
1780,1780,"However, the replication study included results on the variance between the 5 random seeds (original paper reported the mean)",-rn9m0Gt6AQ
1781,1781,*Ablation Study:*,-rn9m0Gt6AQ
1782,1782,I don't believe the replication study performed any ablations,-rn9m0Gt6AQ
1783,1783,*Discussion on results:*,-rn9m0Gt6AQ
1784,1784,The replication study presented an excellent description of the reproducibility of the original paper and made clear when the results reproduced and did not reproduce,-rn9m0Gt6AQ
1785,1785,"They clearly stated that some details were ambiguous, but that they were ultimately able to resolve those details",-rn9m0Gt6AQ
1786,1786,*Recommendations for reproducibility:*,-rn9m0Gt6AQ
1787,1787,The replication study authors and original paper authors seem to have clarified some ambiguities during their discussion,-rn9m0Gt6AQ
1788,1788,Those would be useful to add to the original paper,-rn9m0Gt6AQ
1789,1789,*Results beyond the paper:*,-rn9m0Gt6AQ
1790,1790,The replication study investigates the idea that under-parameterization of the models could lead to a decrease in test accuracy when the hyperparameter controlling attention mass on impermissible tokens increases (less able to pay attention to impermissible tokens),-rn9m0Gt6AQ
1791,1791,They investigated this by increasing the embedding dimension and found it did not improve test accuracy,-rn9m0Gt6AQ
1792,1792,*Overall organization and clarity*,-rn9m0Gt6AQ
1793,1793,* I appreciated the reproduction of the tables from the paper with the author|reproduced! It made it easy to follow along with,-rn9m0Gt6AQ
1794,1794,* Thank you for including the breakdown of the computational requirements for running each task (table 2),-rn9m0Gt6AQ
1795,1795,This is great,-rn9m0Gt6AQ
1796,1796,"* I think the explanation of the seq2seq tasks makes sense if you have read the original paper, but could be confusing if someone has not",-rn9m0Gt6AQ
1797,1797,Please try writing more on this!,-rn9m0Gt6AQ
1798,1798,	,-rn9m0Gt6AQ
1799,1799,The authors follow the Reproducibility Summary very well.,-rn9m0Gt6AQ
1800,1800,The authors re-used the original code repository,-rn9m0Gt6AQ
1801,1801,They also ported the code to PyTorch Lightning to make it easier to reproduce the research in the future.,-rn9m0Gt6AQ
1802,1802,They did not change any hyperparameters and used the same value in the original paper.,-rn9m0Gt6AQ
1803,1803,The authors had fair contact with the authors of original papers and they had discussed minor issues.,-rn9m0Gt6AQ
1804,1804,There are no changes in hyperparameters,-rn9m0Gt6AQ
1805,1805,The implementation results are the average of five-run times of training the model,-rn9m0Gt6AQ
1806,1806,"They used all datasets except the Reference Letters, due to privacy concerns.",-rn9m0Gt6AQ
1807,1807,The authors added two Blue scores in the seq-seq model for translation.,-rn9m0Gt6AQ
1808,1808,"They do not propose any beyond results or improving the original paper, but they have a good discussion that can describe the deep understanding of the paper.",-rn9m0Gt6AQ
1809,1809,There are minor grammar typos.,-rn9m0Gt6AQ
1810,1810,The paper is well written and easy to follow,-rn9m0Gt6AQ
1811,1811,Authors seem to understand the original paper very well and have done a good job in organizing the content,-rn9m0Gt6AQ
1812,1812,"Given one of the classification dataset was not publicly available, reproducing for one task was not feasible",-rn9m0Gt6AQ
1813,1813,Apart from which authors have experimentally verified the claims on other tasks/datasets.,-rn9m0Gt6AQ
1814,1814,Authors have been in constant touch with original paper authors and it is appreciable that original authors have helped in reproducing the experiments by providing data/code as requested by authors along with providing more details/clarifying queries.,-rn9m0Gt6AQ
1815,1815,It is good that the authors had re-implemented BERT model (as the source code was not available initially) and discussed the challenges in re-implementing with information provided in paper which is important for Reproducibility challenge,-rn9m0Gt6AQ
1816,1816,"However, they were not able to replicate the results",-rn9m0Gt6AQ
1817,1817,Once the source code for BERT experiments was provided by original authors they were able to reproduce the results and verify authors claims,-rn9m0Gt6AQ
1818,1818,It would have been interesting if the authors could have identified the reason for performance drop in their re-implementation setting,-rn9m0Gt6AQ
1819,1819,"In table 4, it is interesting to note that there is no change in accuracy for 'Embedding model' on occupation prediction task which is not expected as removing impermissible tokens negatively impacts performance",-rn9m0Gt6AQ
1820,1820,Any explanation for this behavior w.r.t impermissible tokens ?,-rn9m0Gt6AQ
1821,1821,"Table 5 includes accuracies from paper and reproduced results, however the original paper does not report accuracy for the task 'En-De MT' - where do these numbers come from ?",-rn9m0Gt6AQ
1822,1822,"Additionally, authors experiment with different embedding sizes hoping to counter the performance drop as λ increases - however it was inconclusive",-rn9m0Gt6AQ
1823,1823,Having said that authors provide another insight into why they believe could be the reason for performance drop,-rn9m0Gt6AQ
1824,1824,It would have been interesting to see the impact of the way to remove impermissible tokens on performance trend.,-rn9m0Gt6AQ
1825,1825,"Overall, the paper provides good discussion points and clearly outlines what was provided, what was challenging to infer based on the information in paper/code",-rn9m0Gt6AQ
1826,1826,They perform all the experiments mentioned in the original paper and verify the claims along with providing insights and implementation aspect,-rn9m0Gt6AQ
1827,1827,This work helps in understanding the internal details required to reproduce the original paper,-rn9m0Gt6AQ
1828,1828,"Hence, I would recommend to accept this paper.",-rn9m0Gt6AQ
1829,1829,***Reproducibility Summary***,eAy3DVh0xp
1830,1830,The authors provide a complete and useful reproducibility summary.,eAy3DVh0xp
1831,1831,***Scope of reproducibility***,eAy3DVh0xp
1832,1832,The authors clearly state the experiments they are trying to reproduce from the original paper and their setup.,eAy3DVh0xp
1833,1833,***Code***,eAy3DVh0xp
1834,1834,"The authors reimplemented some code and referred to some parts of the original code, which is not complete and is missing parts to reproduce certain experiments.",eAy3DVh0xp
1835,1835,***Communication with the original authors***,eAy3DVh0xp
1836,1836,The authors of the report clearly indicate that they have had limited communication with the original authors of the paper through GitHub issues,eAy3DVh0xp
1837,1837,"Since there were some issues in reproducing some of the results, more communication is encouraged to further investigate the issues.",eAy3DVh0xp
1838,1838,***Hyperparameter search***,eAy3DVh0xp
1839,1839,The authors coducted reasonable hyperparameter searches considering their computational resources and the amount of details provided in the original paper.,eAy3DVh0xp
1840,1840,***Ablation study***,eAy3DVh0xp
1841,1841,The authors have conducted additional ablation studies on the idea proposed in the original paper as an extension of that work.,eAy3DVh0xp
1842,1842,***Discussion on results***,eAy3DVh0xp
1843,1843,"The discussions of the results is through, highlighting what was reproduced, what was not and possible causes.",eAy3DVh0xp
1844,1844,***Results beyond the paper***,eAy3DVh0xp
1845,1845,The authors have included ablation studies as additional results beyond the original paper.,eAy3DVh0xp
1846,1846,***Overall organization and clarity***,eAy3DVh0xp
1847,1847,The report is well organized and it is quite clear.,eAy3DVh0xp
1848,1848,"Overall this is a good report, with reasonable experiments that highlight issues in reproducing some of the experiments in the original paper",eAy3DVh0xp
1849,1849,More communication with the authors is encouraged to try to understand better whether the original results are not correct or there are missing details in this reproduction.,eAy3DVh0xp
1850,1850,"The authors reproduce the paper ""Towards visually explaining variational autoencoders"" [Liu et al",eAy3DVh0xp
1851,1851,2020],eAy3DVh0xp
1852,1852,"The authors provide a brief summary of the paper and try to reproduce all the experiments mentioned in the paper, however for many of the critical experiments the results reported are different from the original paper",eAy3DVh0xp
1853,1853,"For instance, for the MVTec-AD dataset, the authors report numbers in table 2 and for some of the instances, they have double-digit differences in their AUROC measurements",eAy3DVh0xp
1854,1854,"In addition, some of the provided figures are not very informative",eAy3DVh0xp
1855,1855,For example in Fig.2 and Fig.3 qualitative results of the reproduced model as well as the original model are provided however since the frames are not exactly paired it is sometimes hard to do a fair comparison,eAy3DVh0xp
1856,1856,"Furthermore, for some frames that look similar, the attention amps look vastly different.",eAy3DVh0xp
1857,1857,"Furthermore, the language of the report can also be improved.",eAy3DVh0xp
1858,1858,"Also an extension of the original paper, authors investigate applying this method  to stacked RBMs but as they claim they could not obtain any meaningful and explainable results.",eAy3DVh0xp
1859,1859,"In this report, the authors try to reimplement, reproduce and extend results from the paper Liu et al",eAy3DVh0xp
1860,1860,(2020) - Towards visually explaining variational autoencoders,eAy3DVh0xp
1861,1861,The original paper takes a step towards visually explaining generative models by using visual attention maps conditioned on the latent space of a variational autoencoder (VAE),eAy3DVh0xp
1862,1862,The authors of the reproducibility report some parts of the original authors’ code and did slight hyper parameter tuning,eAy3DVh0xp
1863,1863,"Most of the results are claimed to be reproduced for parts of the original paper for which the code was available, while for some other parts, reproducing results was hard",eAy3DVh0xp
1864,1864,"The authors of this report also did not have an extensive communication with the original authors, except minor ones on Github by opening an issue",eAy3DVh0xp
1865,1865,"The report not only tries to reproduce the results from the original paper, but also tried an extension of the work by using Restricted Boltzmann Machines",eAy3DVh0xp
1866,1866,"The authors of the report provide a clear description of the datasets, and include a couple of ablation studies which are useful.",eAy3DVh0xp
1867,1867,Some of the parts which seemed missing or confusing were:,eAy3DVh0xp
1868,1868,"- Include appropriate citations - for example, for Restricted Boltzmann Machines",eAy3DVh0xp
1869,1869,- Line 72 - Figure 9 and 8 in the appendix are referred to,eAy3DVh0xp
1870,1870,But these don’t exist in the appendix,eAy3DVh0xp
1871,1871,- Notation in the Equation 1 can be clarified,eAy3DVh0xp
1872,1872,- Line 138 - Could be made clearer on which parts of the original code are being referred and including more details directly from the paper here would also help.,eAy3DVh0xp
1873,1873,- Formatting of Figure 1,eAy3DVh0xp
1874,1874,- Line 188 - …similar to that of the paper (see 2),eAy3DVh0xp
1875,1875,—> Seems the referred number “2” is Table 2? This can be properly labeled and linked,eAy3DVh0xp
1876,1876,"Overall, the authors seems to reproduce the results and make an educated hyper parameter selection",eAy3DVh0xp
1877,1877,Ablation studies and a couple of insufficiencies from the original paper are also highlighted,eAy3DVh0xp
1878,1878,"If the manuscript can be proof-read and typos and missing figures can be fixed, it can be taken into consideration in the final score",eAy3DVh0xp
1879,1879,"Even though the authors failed to reproduce results regarding performance, they find that the privacy claim is valid",zLzuHtQopDp
1880,1880,They provide a detailed discussion about what was easy and what was difficult when they prepare the reproducibility report,zLzuHtQopDp
1881,1881,The report is well-written and easy to follow,zLzuHtQopDp
1882,1882,The authors did well,zLzuHtQopDp
1883,1883,"Though the codes for the original work was not available, they reproduce the work by coding from scratch.",zLzuHtQopDp
1884,1884,This paper attempts to replicate the work in Interpretable Complex-Valued Neural Networks For Privacy Protection which in general was not possible due to missing details in the original paper.,zLzuHtQopDp
1885,1885,The author provided a good description of the work that they have done to replicate the original,zLzuHtQopDp
1886,1886,The authors identified the details that were missing in the paper,zLzuHtQopDp
1887,1887,"They also mention time constrains, which did not allow them to pursue for example some further hyperparameter tuning.",zLzuHtQopDp
1888,1888,The authors tried to contact the original authors without any success.,zLzuHtQopDp
1889,1889,"What would have been interesting is to provide a full summary of what would have made the reproduction easier, besides providing the pseudo-code.",zLzuHtQopDp
1890,1890,"All-in-all, it is a good paper.",zLzuHtQopDp
1891,1891,"This paper tries to reproduce the results provided in ""Identifying Through Flows for Recovering Latent Representations""",1E7p3r8-zxV
1892,1892,"the authors reproduce the experiments in the original paper obtaining results, which are reasonably close to the original paper's reported numbers, diverging by only about 2.5%",1E7p3r8-zxV
1893,1893,The reproducibility report is written in a clear way having details of the experiments conducted,1E7p3r8-zxV
1894,1894,"Furthermore, the authors investigate further experiments comparing the model with additional Flow-based models to give context to the devised model",1E7p3r8-zxV
1895,1895,"Furthermore, further discussion is done on the applicability as well as the practicality of the iFlow model",1E7p3r8-zxV
1896,1896,I have a few minor questions:,1E7p3r8-zxV
1897,1897,Why are the MCC results so different on different seeds? [Figures 1-3],1E7p3r8-zxV
1898,1898,"In figure 4, the data samples on which iFlow and Flow are compared look actually different and for the iFlow the data itself is more disentangled",1E7p3r8-zxV
1899,1899,Can you please provide some more comparable results for this?,1E7p3r8-zxV
1900,1900,This reproduction report does extensive works on different aspects to verify the original paper iFlow,1E7p3r8-zxV
1901,1901,The authors give a comprehensive study on three objects: 1) reproduce the results of MCC-scores presented in the original paper; 2) they elaborate on the fairness of the metrics used in the original paper; 3) they also evaluate the usability and practical advantages by working on different commonly used machine learning/presentation learning datasets,1E7p3r8-zxV
1902,1902,"The authors of this report find some interesting points which are not presented in the original paper, and they also give a clear presentation of the experiments, analysis, and conclusion",1E7p3r8-zxV
1903,1903,"Therefore, I feel this report is a good reproduction of the iFlow paper, which gives us a better and confidential understanding of the paper",1E7p3r8-zxV
1904,1904, ,1E7p3r8-zxV
1905,1905,This paper discusses reproducing the work included in Learning to Deceive with Attention-Based Explanations by Pruthi et al,VDlDzmfZaxg
1906,1906,Pruthi et al,VDlDzmfZaxg
1907,1907,claim that attention weights can easily be manipulated without significancy accuracy loss and that human subjects can be deceived by this attention weights,VDlDzmfZaxg
1908,1908,The paper focuses on reproducing the first part of the claim as the second part requires a user study,VDlDzmfZaxg
1909,1909,"The paper focuses on three models: embedding, biLSTM, and BERT",VDlDzmfZaxg
1910,1910,"There are two evaluation tasks: classification (occupation, pronoun-based, sentiment analysis), and sequence-to-sequence",VDlDzmfZaxg
1911,1911,"The paper shows that the results do reproduce the results fairly well, and the reproducibility aspect was acceptable (with quick responses from the authors).",VDlDzmfZaxg
1912,1912,"Overall, the writing style in this paper needs to improve",VDlDzmfZaxg
1913,1913,"There are many grammatical mistakes, and the paper does not flow very well",VDlDzmfZaxg
1914,1914,The first half of the paper did a good job of explaining the problem and the models used,VDlDzmfZaxg
1915,1915,"However, the second half of the paper, including the results and reproducibility portions, needs more work",VDlDzmfZaxg
1916,1916,"I would have like to see the differences in training time / evaluation time, better explanation of Table 4 (especially what the column names are), and more information on what correspondence occurred with the original authors (did they give a more thorough code? define the anonymization functions better?) ",VDlDzmfZaxg
1917,1917,"The report describes the efforts in replicating the results of ""Learning to Deceive with Attention-Based Explanations"", where it is shown how 1) attention weights can be manipulated without loss in performance and 2) humans can be deceived by the obtained attention weights",VDlDzmfZaxg
1918,1918,The report describes the efforts in replicating the first claim,VDlDzmfZaxg
1919,1919,"The authors of the report used the code of the original paper to replicate the results, adding the transformer part and missing anonymization functions",VDlDzmfZaxg
1920,1920,"Overall, the results have been extensively replicated and the experiments well described",VDlDzmfZaxg
1921,1921,There are however some parts not well written (e.g,VDlDzmfZaxg
1922,1922,"typos, half-sentences, missing links),  with missing explanations (e.g",VDlDzmfZaxg
1923,1923,"multi-class sentiment analysis, transformer, anonymization) and with critiques to the claims of the paper (e.g",VDlDzmfZaxg
1924,1924,"importance of the user study, capabilities of deceiving of the attention weights) not supported by experiments",VDlDzmfZaxg
1925,1925,"Overall, I think the reproduction effort has been well conducted, but the report needs to be improved (see weaknesses below) to be accepteded",VDlDzmfZaxg
1926,1926,Below I detail what I think are the strengths and the weaknesses of the report,VDlDzmfZaxg
1927,1927,Strengths:,VDlDzmfZaxg
1928,1928,+ The authors managed to replicate all the quantitative results of the main paper (on public datasets) with fair efforts for the missing components they added.,VDlDzmfZaxg
1929,1929,"+ The experiments are very detailed, from the data splits to the hyperparameters used.",VDlDzmfZaxg
1930,1930,+ Discussions on the difference between the reproduced and the original results are also thorough and well justified.,VDlDzmfZaxg
1931,1931,Weaknesses:,VDlDzmfZaxg
1932,1932,"- Maybe it is due to the lack of time, but the report misses careful proofreading",VDlDzmfZaxg
1933,1933,There are Tables not well linked (e.g,VDlDzmfZaxg
1934,1934,"lines 136,172) wrongly cited equations (Eq",VDlDzmfZaxg
1935,1935,"0, line 74), typos (e.g",VDlDzmfZaxg
1936,1936,"""Reproducability"", line 207), missing end of sentence points (line 182), upper case start of sentences (e.g",VDlDzmfZaxg
1937,1937,"line 161), half-sentences (line 202)",VDlDzmfZaxg
1938,1938,Proofreading the report is necessary to ensure its quality,VDlDzmfZaxg
1939,1939,- In Table 3 multiple numbers have an empty standard deviation for the A.M,VDlDzmfZaxg
1940,1940,column,VDlDzmfZaxg
1941,1941,"Why is this the case? The table looks a bit weird with all the empty space after some +-, thus it would be good to add those values (preferably) or eliminate the +-.",VDlDzmfZaxg
1942,1942,- Some parts and definitions are not clear,VDlDzmfZaxg
1943,1943,"For instance, I was not able to find definitions for A.M",VDlDzmfZaxg
1944,1944,"(Table 3-4) and I (equation ""0"")",VDlDzmfZaxg
1945,1945,"Similarly, the report mentions an extension of the paper by performing multi-class sentiment analysis (line 89) that however is not detailed in the following section and is not reported in the results (since the comparison is with the values reported in the original paper)",VDlDzmfZaxg
1946,1946,These details should be included to avoid misconceptions.,VDlDzmfZaxg
1947,1947,"- The attention weights \alpha are computed from the dot product between QK^T  ""softmaxed""",VDlDzmfZaxg
1948,1948,"However, line 54 reports the non-softmaxed version of the dot-product to compute the attention, which is inaccurate",VDlDzmfZaxg
1949,1949,I would suggest the authors,VDlDzmfZaxg
1950,1950,to re-define the attention A by explicitly showing the contribution of \alpha and how it is computed.,VDlDzmfZaxg
1951,1951,- The difficulty of the reproduction due to 1) missing transformer code and 2) missing anonymization (lines 209-210) are not extensively described in the report,VDlDzmfZaxg
1952,1952,"Since the report should highlight the encountered difficulties (if any) in reproducing the original results, I would extend section 2 to include a discussion of any components the authors needed to add to reproduce the results + every effort (e.g",VDlDzmfZaxg
1953,1953,"missing libraries, dataset set up) that was required to reproduce them.",VDlDzmfZaxg
1954,1954,"- The scope of the report is to reproduce the quantitative results of the original work, without reproducing the user studies",VDlDzmfZaxg
1955,1955,"While I agree that the three subjects of the original paper do not constitute a large set allowing drawing general conclusions, I do not think it is fair to say that 1) the human study is unnecessary and unfounded (lines 213-215) and 2) raising doubts on the capabilities to deceive of the model (line 218)",VDlDzmfZaxg
1956,1956,"These are personal thoughts with no scientific/experimental grounds, since not results are shown to support that humans might not be deceived",VDlDzmfZaxg
1957,1957,I strongly suggest removing any claim not supported by 1) experiments 2) experience in the reproduction.,VDlDzmfZaxg
1958,1958,"- The sentence in lines 214-215: ""it added bulk to an unstructured paper, which in our minds, would have benefited from less individual projects""  is non-sensical and not founded anyway since 1) the unstructured paper is the original one? (peer-reviewed and accepted to ACL 2020) 2) what are the individual projects?",VDlDzmfZaxg
1959,1959,"The authors did a good work, they joggle round missing data and came up with same result as the original authors.",VDlDzmfZaxg
1960,1960,Reproducibility Summary:,lE0wqKGROKa
1961,1961,- The summary did a nice job outlining the report.,lE0wqKGROKa
1962,1962,Scope of reproducibility:,lE0wqKGROKa
1963,1963,"- Makes clear what the scope of the report is, and provides nice justification for why certain parts were left out (i.e",lE0wqKGROKa
1964,1964,missing data sets).,lE0wqKGROKa
1965,1965,Code:,lE0wqKGROKa
1966,1966,- Uses the original code,lE0wqKGROKa
1967,1967,- Does an extensive look and dissection of the code base to find some issues worth noting,lE0wqKGROKa
1968,1968,For example:,lE0wqKGROKa
1969,1969,"  - orthogonalization applied to both the P-path and Q-path), which wasn't obvious from the original text",lE0wqKGROKa
1970,1970,They do a small experiment to test the model's sensitivity to this change.,lE0wqKGROKa
