,id,Description,forum_id
0,0,**Reproducibility summary:** The report does not have the mandatory reproducibility summary.,4hm5ufX69jo
1,1,"**Scope of reproducibility:** In Section 3, the authors state that the aim of the section is ""to examine whether self-attention layers in practice do actually learn to operate like convolutional layers when trained on standard image classification tasks.""",4hm5ufX69jo
2,2,**Code:** It's unclear whether the authors used the original authors' code (which is publicly available) or not,4hm5ufX69jo
3,3,"The authors say they ""closely follow the official implementation for reproducing the three embedding schemes and attention mechanisms"" (line 98) but do not discuss how their implementation is similar to or different from the official implementation",4hm5ufX69jo
4,4,"The authors' codebase is clean and organized, but lacks documentation.",4hm5ufX69jo
5,5,**Communication with the original authors**: The authors did not discuss whether they communicated with the original authors,4hm5ufX69jo
6,6,**Hyperparameter search:** The authors did not conduct a hyperparameter search.,4hm5ufX69jo
7,7,**Ablation study**: The authors did not conduct any ablation studies.,4hm5ufX69jo
8,8,**Discussion on results:** The authors reproduced the original paper's CIFAR-10 experiments and reported similar findings,4hm5ufX69jo
9,9,The authors' discussion of their results is on the shorter side (2 paragraphs in Section 3.3),4hm5ufX69jo
10,10,**Recommendations for reproducibility:** The authors did not provide recommendations for reproducibility.,4hm5ufX69jo
11,11,**Results beyond the paper**: This report contains several results beyond the original paper,4hm5ufX69jo
12,12,"In Section 4, the authors discuss two recent works that attempt to replace convolutions with self-attention",4hm5ufX69jo
13,13,"While I found the introduced works interesting, the section lacks discussion of how these works relates to the original paper",4hm5ufX69jo
14,14,"In Section 5, the authors propose a new attention operation named Hierarchical Attention (HA) and demonstrate its effectiveness against normal Self-Attention (SA)",4hm5ufX69jo
15,15,"As the authors emphasize, this operation improves accuracy while using substantially less number of parameters.",4hm5ufX69jo
16,16,"**Overall organization and clarity:** Overall, the report was organized and clearly written",4hm5ufX69jo
17,17,"However, the authors did not include the mandatory reproducibility summary, and did not discuss their experience reproducing the paper (e.g",4hm5ufX69jo
18,18,"methodology, computational requirements, what was easy/difficult, communication with the original authors)",4hm5ufX69jo
19,19,"While the authors presented results beyond the scope of the original work, the report needs more work on the reproducibility front",4hm5ufX69jo
20,20,I also suggest keeping the citation style consistent and using appropriate labels and references to reference tables and figures.,4hm5ufX69jo
21,21,***Reproducibility Summary***,4hm5ufX69jo
22,22,"Unfortunately the authors have not included the mandatory first page reproducibility summary, and following the reviewer guidelines the submission is liable to desk rejection.",4hm5ufX69jo
23,23,***Scope of reproducibility***,4hm5ufX69jo
24,24,The paper does not state clearly the scope of the reproducibility,4hm5ufX69jo
25,25,"The authors reimplement the main experiment in the paper on Cifar, for which they obtain similar results",4hm5ufX69jo
26,26,"They also reproduce a similar experiment where they visualize the attention maps, however their attention maps differ significantly from those shown in the paper and there is no in-depth analysis of them.",4hm5ufX69jo
27,27,***Code***,4hm5ufX69jo
28,28,The authors have implemented their own code to reproduce the paper,4hm5ufX69jo
29,29,"Unfortunately, their code is attached but is not de-anonymized.",4hm5ufX69jo
30,30,***Communication with original authors***,4hm5ufX69jo
31,31,It is not clearly stated in the paper whether the authors of the reproducibility report contacted the original authors of the paper (or at least I couldn't find this information easily),4hm5ufX69jo
32,32,This information could have been readily available if the authors had included a reproducibility summary.,4hm5ufX69jo
33,33,***Hyperparameter search and ablation study***,4hm5ufX69jo
34,34,"The authors conducted limited hyperparameter searches and ablation studies, but the experiments in the original paper are limited in this regard too and therefore it does not seem highly relevant in the evaluation of this report.",4hm5ufX69jo
35,35,***Discussion on results***,4hm5ufX69jo
36,36,The authors do not discuss the results in depth,4hm5ufX69jo
37,37,Most of the conclusions are limited to re-stating the results obtained without properly discussing the differences between their results and the ones found in the original paper,4hm5ufX69jo
38,38,"This can be seen in the discussion for the filter results, for example.",4hm5ufX69jo
39,39,***Recommendations for reproducibility***,4hm5ufX69jo
40,40,The authors do not directly provide recommendations to improve the reproducibility of the original paper.,4hm5ufX69jo
41,41,**Results beyond the paper***,4hm5ufX69jo
42,42,The authors put the focus of this report on a new type of attention they propose,4hm5ufX69jo
43,43,"Unfortunately, this is at the expense of the quality of the rest of the report, and as part of the reproducibility challenge the paper is does not focus enough on reproducing the original paper.",4hm5ufX69jo
44,44,***Overall clarity***,4hm5ufX69jo
45,45,"The article could be better organized, providing first a reproducibility summary.",4hm5ufX69jo
46,46,***Overall rating***,4hm5ufX69jo
47,47,"I argue for the rejection of this article based on the omission of the mandatory reproducibility summary, the lack of clarity and the focus on the results beyond the paper but not on reproducing the results of the original paper.",4hm5ufX69jo
48,48,The authors do not provide reproducibility summary and the manuscript does not match the expected template,4hm5ufX69jo
49,49,There is no discussion about the scope of reproducibility nor any discussion over what was easy/hard,4hm5ufX69jo
50,50,Missing evaluations from the appendix section of the paper.,4hm5ufX69jo
51,51,"Overall, authors are able to replicate the experiments reported in the original paper",4hm5ufX69jo
52,52,They also show additional experiments with other choice of attention-based networks which is interesting,4hm5ufX69jo
53,53,Current analysis lacks visualizations for 'centers of attention' which is important,4hm5ufX69jo
54,54,Why is the #params in table 1 and 2 same ? Is the accuracy(paper) in table 2 correct comparison ?,4hm5ufX69jo
55,55,"It is commendable that along with reproducing results, the authors propose hierarchical attention operation and evaluate it's performance",4hm5ufX69jo
56,56,They show that it resolves the computational memory requirement as intended,4hm5ufX69jo
57,57,"However, keeping the scope of this venue in consideration the paper does not match the expected format and lacks detailed analysis.",4hm5ufX69jo
58,58,*Problem statement: ,PRXM8-O9PKd
59,59,"The paper clearly states the reproducing details, together with the detailed results and difficulties.",PRXM8-O9PKd
60,60,*Presentation:,PRXM8-O9PKd
61,61,The paper is well-organized and well-written,PRXM8-O9PKd
62,62,*Communication with original authors,PRXM8-O9PKd
63,63,The authors had some communication with the original authors.,PRXM8-O9PKd
64,64,*Code:,PRXM8-O9PKd
65,65,The code is well-organized and can be reproduced,PRXM8-O9PKd
66,66,I have tested the code on my side and all components work well,PRXM8-O9PKd
67,67,*Recommendations for reproducibility,PRXM8-O9PKd
68,68,The authors provided useful comments for reproducing the original paper,PRXM8-O9PKd
69,69,I have read the code and found those comments are consistent with the provided codes,PRXM8-O9PKd
70,70,*A few concerns,PRXM8-O9PKd
71,71,**The tense is not consistent in the whole paper,PRXM8-O9PKd
72,72,"In some sections, the author used past tense while the present tense is used in some other sections",PRXM8-O9PKd
73,73,"** It will be even better if the authors can provide a simple illustration on the two major algorithms, like Fig.3 and Fig.4 in the original paper",PRXM8-O9PKd
74,74,The figures and simple explanations would help readers to follow your report.,PRXM8-O9PKd
75,75,The authors developed code for the original paper from scratch and communicated with the original authors for detail,PRXM8-O9PKd
76,76,"They provide a in-depth, easily readable, well organized report and analysis",PRXM8-O9PKd
77,77,They include extensive HPO,PRXM8-O9PKd
78,78,They give valuable recommendations for future work,PRXM8-O9PKd
79,79,"Unfortunately, code will only be submitted only after the review process.",PRXM8-O9PKd
80,80,__Summary__,ysFCiXtCOj
81,81,"The original paper (OP) proposes a new activation function, snake",ysFCiXtCOj
82,82,"Snake is claimed to be usable with datasets both with and without cyclicity, on the contrary to previous activations",ysFCiXtCOj
83,83,"Experiments include low-dimension regression to illustrate the limitations of conventional activations, and applications of snake and baselines to timeseries to illustrate their ability (or not) to deal with cyclic data",ysFCiXtCOj
84,84,Snake is also evaluated on common benchmarks (CIFAR10) to show that it performs well compared to baselines even when the dataset is not cyclic.,ysFCiXtCOj
85,85,This reproducibility report (RR) reproduces all the experiments of the OP and confirms the OP's findings.,ysFCiXtCOj
86,86,"The RR also extends the study to two new settings (image generation and sentiment analysis), both non-cyclic, in which the performance of snake is studied.",ysFCiXtCOj
87,87,__Positive points__,ysFCiXtCOj
88,88,"- The OP's code was not publicly available and the authors recoded all of the experiments themselves, which needs to be commended.",ysFCiXtCOj
89,89,"- Similarly, the authors optimized hyperparameters to make the implementations work despite the fact that they were missing in the original paper.",ysFCiXtCOj
90,90,- The authors performed additional experiments with elaborate models,ysFCiXtCOj
91,91,"Both the feedforward and recurrent architectures that were used were not tested in the original paper, which demonstrates the applicability of the original idea to new settings and  adds value to the original idea from the OP.",ysFCiXtCOj
92,92,- I appreciated the exhaustive replication of the several experiments that this paper contained.,ysFCiXtCOj
93,93,"- The RR authors contacted of the OP authors to get additional information on the points of the paper that lacked clarity, and used this information to replicate the OP results.",ysFCiXtCOj
94,94,"- The format of the reproducibility report was respected, and the report is overall clear",ysFCiXtCOj
95,95,The authors clearly state that the results are reproducible,ysFCiXtCOj
96,96,The report is overall well written and concise.,ysFCiXtCOj
97,97,__Negative points__,ysFCiXtCOj
98,98,"- The general experiments are reproduced, but I find that a finer analysis is absent from the RR",ysFCiXtCOj
99,99,"The results are reproduced through a figure, but this figure is often not referred to",ysFCiXtCOj
100,100,A small conclusion about the reproducibility of the specific experiment is systematically absent,ysFCiXtCOj
101,101,"No quantified metric on the closeness to the original performance is given, or commented, even though the paper gave quantified results for the financial experiment (OP's Tab.2)",ysFCiXtCOj
102,102,"For instance, when the performance is illustrated through a graph, I would have expected a comment on the closeness between the accuracy of the OP's model and the RR's model.",ysFCiXtCOj
103,103,- I find that the report lacked precision,ysFCiXtCOj
104,104,"For instance: (1) I am not sure which optimizer was used for most of the experiments, or what initialization; Sec 4.1 is an example of this",ysFCiXtCOj
105,105,"(2) p.6, l.146: ""orders of magnitude"": how many? Can you give an estimate of the time in each case? (3) p.7, l.159: can you be more precise than ""reasonably realistic samples""? Are there metrics that exist that could quantify by a number the quality of the images produced? (4) p.8, l.163: took much longer: can you be more precise? etc.",ysFCiXtCOj
106,106,"- I find that overall, the report does not take a step back w.r.t the experiments it makes",ysFCiXtCOj
107,107,"As a consequence, the RR did not reflect on some of the differences, notably Fig.3 (the snake network starts to diverge, on the contrary to OP's Fig",ysFCiXtCOj
108,108,4) and Fig.5 (the snake network does not fit the training points): how can these differences be explained? ,ysFCiXtCOj
109,109,"- The RR mentions having to find / guess some hyperparameters (Sec 3.3), but does not comment on the value that was ultimately found and used in the report, or the range of hyperparameters that was tested",ysFCiXtCOj
110,110,"It is true that the code is available on Github, but an explicit reference to it would help lift the doubt on certain implementation details",ysFCiXtCOj
111,111,"For now, the reader does not gain the knowledge missing from the OP by reading the RR.",ysFCiXtCOj
112,112,"- It was often difficult to separate the RR's conclusions from the OP's (for instance, it is confusing on a first read if the last paragraph of p.5 contains conclusions from the RR's authors or the OP's authors, or even if the experiment itself was in the OP (since the experiment does not appear in the main paper, but in the appendix)).",ysFCiXtCOj
113,113,===,ysFCiXtCOj
114,114,"Overall, I believe the report could be improved by introducing each experiment better, providing the implementation details, and giving a conclusion on the reproducibility of each experiment",ysFCiXtCOj
115,115,"Adding numerical results indicative of reproducibility (was the reproduced end accuracy of the model within X% of the OP's results?) for each experiment would help ground the report, and help it discuss in more details the state of reproducibility of the OP.",ysFCiXtCOj
116,116,===,ysFCiXtCOj
117,117,__Additional comments__,ysFCiXtCOj
118,118,"- Some figures are not referenced (ex: Fig.2, Fig.3, Fig.4,)",ysFCiXtCOj
119,119,This is problematic because this reinforces the idea that the experiment was run in the RR without an analysis of its results and its significance,ysFCiXtCOj
120,120,How can you tell that the results were indeed replicated?,ysFCiXtCOj
121,121,- The RR mentions that reimplementing the initialization was not obvious from the paper and that one of the OP's authors helped,ysFCiXtCOj
122,122,An additional comment about what was the problem / what was the solution found (or at least a pointer to the RR's code) would be useful.,ysFCiXtCOj
123,123,- Regarding the discussion of Fig.8: it seems to me that the difference between the RNN and the MLP could simply be due to a regularization effect: the RNN also seems to learn the right lower frequency,ysFCiXtCOj
124,124,"- The authors mention in the reproducibility summary that they reimplemented everything from scratch, though looking at the code, it appears that some implementations (of the LaProp optimizer or of the base code for the GAN) were based on existing codebases",ysFCiXtCOj
125,125,"While obviously the authors are not expected to recode *everything* from scratch, it would be more transparent to indicate that some parts of the code were built on top of existing code in the RR",ysFCiXtCOj
126,126,"- A mention of the software used (Pytorch for the neural networks) would have been useful, as all libraries do not have necessarily the same default hyperparameters",ysFCiXtCOj
127,127,"Similarly, the authors mention in Sec",ysFCiXtCOj
128,128,"3.5 that many experiments could be run locally: more details on the local hardware (which CPU for instance, a minima an indication on the quality of the ""local"" computer that was used) would be welcome.",ysFCiXtCOj
129,129,- The RR mentions that making the parameter  a learnable was not properly explained in the OP,ysFCiXtCOj
130,130,"Here too, a pointer to the solution found would be appropriate.",ysFCiXtCOj
131,131,- The introduction is extremely close to the one in the OP,ysFCiXtCOj
132,132,"I would suggest reformulating the introduction more, or possibly shorten it, to avoid repeating the OP.",ysFCiXtCOj
133,133,"- The figures were overall well made and close in design to the original paper, which helps when comparing results",ysFCiXtCOj
134,134,"Possible improvements could be to respect the color attribution for different models (Fig.2) and making sure that the scale of two plots coincide to make comparisons easier (Fig.10 top left and bottom left, Fig.13 for instance).",ysFCiXtCOj
135,135,The paper is well written and clearly structured.,ysFCiXtCOj
136,136,It is a valuable confirmation of the original paper.,ysFCiXtCOj
137,137,I only have a few formatting criticisms:,ysFCiXtCOj
138,138,"sin, cos, and snake should not be italic, but rather \sin or {\rm sin",ysFCiXtCOj
139,139,"I think, „4e -4“ should be relaced by 0.0004 or 4\cdot 10^{-4}",ysFCiXtCOj
140,140,"In Section 4.4 „Effect of \alpha$, use \boldmath{\alpha}",ysFCiXtCOj
141,141,"The presented report is well organized, systematic, clear and concise with most of the major experimental results reproduced and reported",ysFCiXtCOj
142,142,"To begin with, authors have clearly mentioned the key claims to be investigated in the scope of reproducibility with the focus on the properties of  the activation functions and their behaviour in the experiments reported in the original paper",ysFCiXtCOj
143,143,It has also been proposed to conduct additional experiments beyond what is already covered in the source paper,ysFCiXtCOj
144,144,"These includes DCGAN for handwritten digit generation and LSTM model for sentiment analysis, each modified to include the proposed snake activation function",ysFCiXtCOj
145,145,"It is however to be noted that when result plots for different cases are not reported in the same graph, it helps to report them on the same scale, wherever possible (e.g",ysFCiXtCOj
146,146,"Figure 12 and 13), for easier comparison.",ysFCiXtCOj
147,147,"Due to the unavailability of the source code from the author's of original paper, the current authors, in consultation with the original authors, have done a good job of replicating the results, which is matching qualitatively to a great extent with the ones reported in the original paper",ysFCiXtCOj
148,148,"While the architectural details were available in the original text, the hyper-parameters and any other information missing were assumed and arrived at with trial and error.",ysFCiXtCOj
149,149,Most of the results from the main content of the original paper has been reported and are found to be qualitatively matching,ysFCiXtCOj
150,150,Figure 1 has demonstrated the inability of learning periodicity outside of the training region and thus substantiates the claim 1 of the scope of reproducibility,ysFCiXtCOj
151,151,These reporting also matches with the corresponding figure in the original work for the widely used activation functions - ReLU and Tanh.,ysFCiXtCOj
152,152,"To substantiate claim 2 which states that the proposed snake activation function captures periodicity outside of the training samples and also maintains favourable optimization properties such as loss reduction comparable to or better than ReLU activation, corresponding results from original work has also been reproduced",ysFCiXtCOj
153,153,"Although the frequency of the sin wave used in the experiment appears to be different, it is helpful in demonstrating that even though periodicity is observed, significant deviations can still occur at far away places from the training samples",ysFCiXtCOj
154,154,"Nevertheless, differences in implementations can be a source of difference.",ysFCiXtCOj
155,155,"In addition to the demonstrations on synthetic datasets discussed earlier, the authors have further reproduced results on real-world/application oriented datasets that includes performance reporting of ResNet18 on CIFAR-10 dataset, atmospheric temperature prediction in Minamitorishima island (Japan), patient body temperature prediction and Wilshere 5000 index prediction",ysFCiXtCOj
156,156,All these reported results corroborates the points in the original paper across varying and diverse datasets.,ysFCiXtCOj
157,157,"Finally, the authors have reported results for a few experiments from the Appendix section such as the one showing the effect of various value of $a$",ysFCiXtCOj
158,158,It is also admirable that they have reported results and discussed implications of use of snake activation function in other scenarios such as training DCGANs and LSTMs,ysFCiXtCOj
159,159,"While the snake activation was shown to have reasonable and comparable training speed and test performances as evidenced by Figure 2 and 4, the extra experiments on non-toy datasets helped in highlighting the relatively slow training speed.",ysFCiXtCOj
160,160,"Thus, overall, the authors have tried to cover extensive set of experiments demonstrating pros and cons of the proposed snake activation function and have reproduced the results qualitatively to a great extent",ysFCiXtCOj
161,161,The difficulty in reproducing some of the work such as comparison with RNN on regressing a Simple Periodic function where the details were missing and the data points had to be inferred from the graphs have been mentioned,ysFCiXtCOj
162,162,"Similarly, it is also suggested to clarify the implementation details for showing variance correction using ResNet101 on CIFAR-10 for better reproducibility.",ysFCiXtCOj
163,163,"In this report, the authors reproduce the experiment parts of the paper: ""Can Gradient Clipping Mitigate Label Noise?"" by Aditya Krishna Menon, Ankit Singh Rawat, Sashank J",TM_SgwWJA23
164,164,"Reddi, Sanjiv Kumar.",TM_SgwWJA23
165,165,The main contributions of this report are: ,TM_SgwWJA23
166,166,1,TM_SgwWJA23
167,167,The authors reproduce experiments of the original paper to prove that Partially Huberised Loss does have label noise robustness.,TM_SgwWJA23
168,168,2,TM_SgwWJA23
169,169,The authors report corrected hyperparameters that were reported incorrectly in the original paper.,TM_SgwWJA23
170,170,3,TM_SgwWJA23
171,171,"Although it's not so much different from what the original paper insists, the authors provide results that are different from the original paper.",TM_SgwWJA23
172,172,4,TM_SgwWJA23
173,173,The authors clarify that the ResNet-50 architecture used in the original paper differs from the architecture of He et al,TM_SgwWJA23
174,174,2015 (this choice was not made clear in the original paper) and explains why this modification is necessary.,TM_SgwWJA23
175,175,Minor issue:,TM_SgwWJA23
176,176,"In experiments using Long & Servedio dataset, there is no explanation for why is the accuracy becomes lower when the corruption rate ρ is lower.",TM_SgwWJA23
177,177,Verdict:,TM_SgwWJA23
178,178,The report contains some solid experiments and additional information and corrections not in the original paper,TM_SgwWJA23
179,179,I can see researchers trying to build upon the original paper benefitting from reading this reproducibility report,TM_SgwWJA23
180,180,"For this reason, I recommend the report be accepted.",TM_SgwWJA23
181,181,The report aims to reproduce a paper on so-called Partially Huberised losses,TM_SgwWJA23
182,182,These losses are used to mitigate the label noise,TM_SgwWJA23
183,183,The report replicates all the experiments from the original paper and makes insightful discoveries.,TM_SgwWJA23
184,184,The report is well-written and easy to follow,TM_SgwWJA23
185,185,The original paper is summarized and all the experiments are described in details,TM_SgwWJA23
186,186,The report also mentions the communication with the authors of the original paper which revealed some typos or mistakes in the original paper.,TM_SgwWJA23
187,187,"The original paper was reproduced from scratch with a different framework (PyTorch, instead of Tensorflow)",TM_SgwWJA23
188,188,This is good way to test the reproducability.,TM_SgwWJA23
189,189,Suggestions for improvements:,TM_SgwWJA23
190,190,"- The very first section ""Scope of Reproducability"" should discuss, the scope",TM_SgwWJA23
191,191,What the report reproduces and what it does not.,TM_SgwWJA23
192,192,- The hyper-parameter search is the same as in the original paper,TM_SgwWJA23
193,193,The report does not go an extra mile to search wider space,TM_SgwWJA23
194,194,"Nevertheless, I understand that such experiments may be time consuming and require a lot of computational resources.",TM_SgwWJA23
195,195,"- It is always desirable to include extra datasets, extra experiments, more architectures to more thoroughly test the claims of the original paper.",TM_SgwWJA23
196,196,- Section 4.2.2 mentions that the reproduced experiments used the mixed precision for training,TM_SgwWJA23
197,197,The report should clarify if this is different from the original paper and if it may influence the results.,TM_SgwWJA23
198,198,"Overall, this is a good report",TM_SgwWJA23
199,199,I recommend accept.,TM_SgwWJA23
200,200,The report aims to reproduce the results of the paper 'Can gradient clipping mitigate label noise?' The report gives a summary of how the reproduction is conducted and briefly introduce the original paper,TM_SgwWJA23
201,201,The paper also gives the details including the hyper-parameters and computational infrastructures,TM_SgwWJA23
202,202,The authors provides the reproducing codes with detailed documentation.,TM_SgwWJA23
203,203,The given report examines the reproducibilty of a deep denoising model SADNet for natural images based on spatial-adaptive residual blocks,yiAI9QN9nYt
