,id,Description,forum_id
2609,2609,A description or at least a pointer to the RR code would have been appreciated,Gsj8MmNkA6L
2610,2610,"Moreover, background on some choices (for instance, why the value of sigmas in Fig.6 and Fig.7?) would have helped understand the design choices.",Gsj8MmNkA6L
2611,2611,===,Gsj8MmNkA6L
2612,2612,"Overall, I find that this was an encouraging report that addressed the general reproducibility of the paper",Gsj8MmNkA6L
2613,2613,I appreciated the initiative to propose new experiments,Gsj8MmNkA6L
2614,2614,Reorganizing the report would greatly improve its readability,Gsj8MmNkA6L
2615,2615,"While the new experiments were interesting, I found that the report would benefit from a deeper discussion on the current state of reproducibility",Gsj8MmNkA6L
2616,2616,"Adding details on the methodology of the experiment, what the RR authors set to reproduce in this specific experiment, and a clear conclusion on the reproducibility of the experiment would also improve this report to help it make a more grounded statement on the status of reproducibility of the paper in general.",Gsj8MmNkA6L
2617,2617,===,Gsj8MmNkA6L
2618,2618,__Additional comments__,Gsj8MmNkA6L
2619,2619,- Fig,Gsj8MmNkA6L
2620,2620,"1 is very helpful, but takes too much space in the RR",Gsj8MmNkA6L
2621,2621,Consider making it smaller.,Gsj8MmNkA6L
2622,2622,- Is it not clear what is i in the equations of Sec 3.1,Gsj8MmNkA6L
2623,2623,The summation signs do not indicate what variable is being summed.,Gsj8MmNkA6L
2624,2624,- In Tb,Gsj8MmNkA6L
2625,2625,1: is the training time a new result? A reproduced one? This is not said clearly.,Gsj8MmNkA6L
2626,2626,- The authors study changing the constant number in the two-sided gradient penalty (Sec 4.2.3),Gsj8MmNkA6L
2627,2627,"At the first reading, it is not clear what exactly is changed since the letter c is already used in the precise equation of the gradient, but not with the same meaning as in Sec 4.2.3",Gsj8MmNkA6L
2628,2628,Additional precision on the exact quantity that is being changed and additional care to the notation could improve the understanding of what the RR tried to do.,Gsj8MmNkA6L
2629,2629,"- The term ""sensitivity"" in Sec 3.1 is not defined.",Gsj8MmNkA6L
2630,2630,"The authors test two claims made by the original paper: the ability of the proposed approach to detect OOD, and the role of different hyperparameters as an ablation study",Gsj8MmNkA6L
2631,2631,"In addition to that, the authors explore sensitivity of the proposed algorithm to noise, and propose an extension for explicit detection of aleatoric and epistemic uncertainty.",Gsj8MmNkA6L
2632,2632,"* Re noise sentivity of the algorithm (Figure 6), it is quite surprising that Deep Ensemble or E-DUQ perform so much worse that DUQ, even when we reject 95% of data",Gsj8MmNkA6L
2633,2633,Can the authors give more details and better explain why that is the case?,Gsj8MmNkA6L
2634,2634,"* In Table 1-5, how many splits (or randomly generated train datasets) were used?",Gsj8MmNkA6L
2635,2635,* Please provide confidence intervals in tables (e.g,Gsj8MmNkA6L
2636,2636,5-95% quantiles) for performance metrics,Gsj8MmNkA6L
2637,2637,"Otherwise, it is hard to assess what is significant",Gsj8MmNkA6L
2638,2638,"For AUROC, you need to report bootstrapped values.",Gsj8MmNkA6L
2639,2639,* More details about lengthscale prediction would be needed (section 4.2.2),Gsj8MmNkA6L
2640,2640,Minor:,Gsj8MmNkA6L
2641,2641,"* The authors make several grammatical mistakes, e.g., in the usage of articles ""the""",Gsj8MmNkA6L
2642,2642,"The abstract has no subject in their sentences, periods are often separated from the final word",Gsj8MmNkA6L
2643,2643,"Overall, although the text is understandable, the writting would need some polishment, and it would be nice if the English could be checked by a spell checker.",Gsj8MmNkA6L
2644,2644,* Eq,Gsj8MmNkA6L
2645,2645,"54-55, what is m_{c,t}? Not defined in the text.",Gsj8MmNkA6L
2646,2646,"* The explanation about the gradient penalties is not self-contained, that is, it is not understandable without having to go back to the original paper, so either remove it or make it self-contained.",Gsj8MmNkA6L
2647,2647,"* Because this is a reproducibility challenge, the authors should provide more details on experimental setup to generate Tables 1-5 (what hyperparameters, setups, splittings, number of runs, etc, etc).",Gsj8MmNkA6L
2648,2648,The authors of this report provide a complete open-source reimplementation of the original method as well as the figures provided in the original paper,vOIGINzuJR6
2649,2649,They find some discrepancies and variance in the results,vOIGINzuJR6
2650,2650,The authors do not go beyond the original content of the paper in terms of understanding the method; they do superficially report some unsuccessful attempts to improve it.,vOIGINzuJR6
2651,2651,Format: the authors correctly follow the format required for the challenge.,vOIGINzuJR6
2652,2652,Scope: the authors (attempt to) reproduce all the results from the paper,vOIGINzuJR6
2653,2653,Code: at a glance the provided code appears complete,vOIGINzuJR6
2654,2654,It was written from scratch since no code is provided in the Original Paper,vOIGINzuJR6
2655,2655,Communication & hyperparameters: the authors have done their due diligence,vOIGINzuJR6
2656,2656,"Ablation: the authors perform the same ablation study as in the OP, finding some differences, but do not report further ablative modifications",vOIGINzuJR6
2657,2657,They also perform a similar sensitivity analysis.,vOIGINzuJR6
2658,2658,Discussion: the authors make appropriate discussions and remarks on reproducibility,vOIGINzuJR6
2659,2659,Comments:,vOIGINzuJR6
2660,2660,"- there seems to be a typo in eq (4), \lambda was replaced by some text",vOIGINzuJR6
2661,2661,- broken reference on line 171,vOIGINzuJR6
2662,2662,"- Figure 1: the labels of the plots are pretty small, in academic papers labels should have the same font size than the main text ",vOIGINzuJR6
2663,2663,"- “We first defined performance as train target accuracy, [then test]”, this is a nice insight, but not the correct way to do this",vOIGINzuJR6
2664,2664,"If using the training data, then you are only measuring memorization, if using the test data, then you’ve “cheated” and your test data is no longer test data, and no longer gives you an unbiased estimate of the performance of your method",vOIGINzuJR6
2665,2665,"The correct way to do this would be to split your training data in two, i.e",vOIGINzuJR6
2666,2666,"create a validation set, and use this validation set solely to determine early stopping",vOIGINzuJR6
2667,2667,- missing Figure reference on lines 224 and 236,vOIGINzuJR6
2668,2668,- the authors critique the OP for not having the same number of random seeds per hyperparameter setting,vOIGINzuJR6
2669,2669,Is this referenced somewhere in the OP? Or is this from an email exchange? These numbers should be made explicit.,vOIGINzuJR6
2670,2670,- Figure 3 & sensitivity analysis: the authors note that “there is very little similarity to be found in any of the accuracy landscapes”,vOIGINzuJR6
2671,2671,"Experiments have natural variance, especially since different random seeds are used (and small code differences probably still remain)",vOIGINzuJR6
2672,2672,Considering the closeness (there isn’t much difference between 0.71 and 0.73) of the bounds of the colorbars it would be quite unexpected for the same peaks and valleys to show up,vOIGINzuJR6
2673,2673,"This shows that this method is robust to these two hyperparameter choices, or alternatively, that these two hyperparameters do not influence the results.",vOIGINzuJR6
2674,2674,"- stylistic comment: the authors use the “we” voice in a lot of contexts, this makes it hard to distinguish between what is something that they contribute (e.g",vOIGINzuJR6
2675,2675,"novel measures, novel hyperparameters or other choices) and something done by the original authors",vOIGINzuJR6
2676,2676,"Alternatively, the passive voice can be used, for example:",vOIGINzuJR6
2677,2677,  - “We combine these two loss terms into a single term” -> “These two loss terms are combined into a single term”,vOIGINzuJR6
2678,2678,"  - “after completing training, we train two classifiers” -> “after completing training, two classifiers are trained”",vOIGINzuJR6
2679,2679,"- on language & grammar: the text is very readable, but contains some typos and grammatical mistakes and would benefit from additional proofreading.",vOIGINzuJR6
2680,2680,"This report presents an attempt at reproducing results from « Fairness by learning orthogonal disentangled representations » (Sarhan et al., 2020)",vOIGINzuJR6
2681,2681,"In that paper, a representation learning algorithm is proposed to learn « fair » representations (i.e., representations from which sensitive attributes cannot be easily predicted) by learning two separate representations (one for the class of interest and one for sensitive attributes) that should be both disentangled and orthogonal to each other",vOIGINzuJR6
2682,2682,"This reproducibility work is only partially able to reproduce the original paper’s results, in part at least due to the lack of open source implementation and some missing experimental details.",vOIGINzuJR6
2683,2683,"The report’s authors clearly state their objective, explain what they have done (and what was easy/difficult), and compare their results to the original paper",vOIGINzuJR6
2684,2684,"This is a significant effort since they had to start from scratch, and they attempted to reproduce more than just the main results (they also include an ablation study and a sensitivity analysis)",vOIGINzuJR6
2685,2685,I also appreciate that there is a well documented open source repository to easily re-run these experiments.,vOIGINzuJR6
2686,2686,My main concern is that it remains unclear why some of the results are so far off from the original paper,vOIGINzuJR6
2687,2687,"In particular, the YaleB and CIFAR-100 results are worrying, since the model is clearly unable to learn the task at hand",vOIGINzuJR6
2688,2688,"I would have expected the authors to dig deeper on that, for instance by doing more ablations / hyper-parameter search to at least identify which parts of the loss / model are responsible for this issue",vOIGINzuJR6
2689,2689,"Without such an analysis, there remains some doubt regarding the correctness of the implementation.",vOIGINzuJR6
2690,2690,Another potential concern is that it is not clear from the descriptions of the datasets in 3.2 that the definitions of the sensitive attributes match what was done by Sarhan et al,vOIGINzuJR6
2691,2691,on the YaleB and CIFAR datasets,vOIGINzuJR6
2692,2692,Could you please clarify that point in the report?,vOIGINzuJR6
2693,2693,Small remarks:,vOIGINzuJR6
2694,2694,- On .81 should « based on z_T » be « based on z_S »?,vOIGINzuJR6
2695,2695,- I find eq,vOIGINzuJR6
2696,2696,3 a bit confusing because q_phi_S is applied with z_T as input instead of z_S: how is that possible?,vOIGINzuJR6
2697,2697,- In eq,vOIGINzuJR6
2698,2698,4 there is probably a missing \ in the Latex code,vOIGINzuJR6
2699,2699,- l,vOIGINzuJR6
2700,2700,171 has a missing reference,vOIGINzuJR6
2701,2701,- What are the horizontal dashed lines in the plots?,vOIGINzuJR6
2702,2702,- References to figures in the Appendix seem broken (ex: l,vOIGINzuJR6
2703,2703,"224, but there are more)",vOIGINzuJR6
2704,2704,- l,vOIGINzuJR6
2705,2705,360: « We should check whether these are in fact the last hyperparameters we used » => was this sentence supposed to be included?,vOIGINzuJR6
2706,2706,The paper provides a thorough explanation of the reproducibility efforts,OownuYG0SOC
2707,2707,"It could possibly be improved by providing more experiments, especially on the attempts to apply the approach to new examples",OownuYG0SOC
2708,2708,"(Hyper)parameter choices are mostly adopted from the paper and could have been experimented with, too.",OownuYG0SOC
2709,2709,The summary is somewhat vague in some places,OownuYG0SOC
2710,2710,"For instance, the authors state: ""The accuracy, however, when running Experiment 3 (38%) is much lower than in the paper",OownuYG0SOC
2711,2711,"This is because we divided the amount of Monte-Carlo samples by 5"" This needs some motivation as to why the number of samples was changed and whether this is a problem or not.",OownuYG0SOC
2712,2712,"Great to see, authors have been in touch with the original paper authors.",OownuYG0SOC
2713,2713,"This work aims to reproduce and examine the claims made in ""Generative Causal Explanations of Black Box Classifiers""",OownuYG0SOC
2714,2714,The authors do so by reproducing the original results presented in the paper and additionally evaluating against imagenet to test the behavior on a more challenging dataset,OownuYG0SOC
2715,2715,"The authors remark that they are unable to fully reproduce the results, though this is likely because they did not evaluate using the exact same procedure due to a reduction in the number of Monte Carlo samples",OownuYG0SOC
2716,2716,They also evaluate using the image net dataset and show worse behavior,OownuYG0SOC
2717,2717,"However, it isn't clear to me if this degraded performance can also be attributed to the same issues that prevented reproducibility on the original experiments",OownuYG0SOC
2718,2718,"Overall, I think the authors made a nice attempt at reproduction (MC samples aside), and do well to consider an additional dataset",OownuYG0SOC
2719,2719,"I found the rationale behind the extension to be solid, and very important when thinking through considerations that go into applying a model in more realistic settings",OownuYG0SOC
2720,2720,I have two core issues with this reproduction:,OownuYG0SOC
2721,2721,1,OownuYG0SOC
2722,2722,The paper is generally difficult to follow,OownuYG0SOC
2723,2723,The paper reads closer to an outline than a finished report,OownuYG0SOC
2724,2724,"I would encourage the authors to spend some additional time on organization, making sure that the key takeaways are made plain and that the report reads fluidly throughout",OownuYG0SOC
2725,2725,2,OownuYG0SOC
2726,2726,"This reproduction tests one additional dataset is commendable, but I would have liked to see some examination that gets closer to the behavior of the method",OownuYG0SOC
2727,2727,"For example, robustness to hyperparameters, model complexity, and other behaviors",OownuYG0SOC
2728,2728,3,OownuYG0SOC
2729,2729,"It is not entirely clear to me why the authors chose to use less MC samples, since it hampered the ability to fully evaluate the claims of the paper",OownuYG0SOC
2730,2730,"In this paper, the authors reported results from the reproducibility study of [1].",BHqmQ6tnb3N
2731,2731,Pros: ,BHqmQ6tnb3N
2732,2732,"1), successfully reproduced the results reported in the original paper",BHqmQ6tnb3N
2733,2733,"2), went beyond the empirical study in the original paper by testing the method with networks of more complicated architectures and additional datasets of increased learning difficulty to test the scope of the usability of the method",BHqmQ6tnb3N
2734,2734,"3), performed study of searching for hyperparameters: K, L, \lambda",BHqmQ6tnb3N
2735,2735,"4), good communications with authors of original paper",BHqmQ6tnb3N
2736,2736,Cons:,BHqmQ6tnb3N
2737,2737,"1), the writing needs substantial improvement",BHqmQ6tnb3N
2738,2738,"2), study of using more complicated generative model is needed for more complicated classifiers or learning tasks",BHqmQ6tnb3N
2739,2739,The proposed method in the original paper may still perform well using more complicated generative models for cases where there is increased complicity in the learning task and classifier,BHqmQ6tnb3N
2740,2740, ,BHqmQ6tnb3N
2741,2741,"The report details reproduction of the paper ""Generative causal explanations of black-box classifiers"" by O’Shaughnessy et al",BHqmQ6tnb3N
2742,2742,The authors tried to do all the right things and even go beyond only reproducibility but also to extend the original experiments but some parts are rushed and some conclusions drawn are questionable.,BHqmQ6tnb3N
2743,2743,Reproducibility Summary: is provided but it is quite short and cover the main points of the reports only at the very high level,BHqmQ6tnb3N
2744,2744,It could have been extended to include more specific details.,BHqmQ6tnb3N
2745,2745,Scope of reproducibility: is clearly stated and is followed in the later text.,BHqmQ6tnb3N
2746,2746,Code: the authors used the code provided by the original authors of the paper,BHqmQ6tnb3N
2747,2747,They mentioned several issues with the code which they had to overcome (sometimes with the help of the original authors),BHqmQ6tnb3N
2748,2748,The release code by the authors of the report looks quite readable and well organised.,BHqmQ6tnb3N
2749,2749,Communication with original authors: The report mentions communication with the original authors but mostly in terms of working with their code,BHqmQ6tnb3N
2750,2750,"However, the authors emphasise that the main issue with reproducibility was selection of hyperparameters and no discussion of that with the original authors is mentioned.",BHqmQ6tnb3N
2751,2751,"Hyperparameter Search: the authors emphasise that hyperparameter search method provided in the original paper is not very clear, nor it is well motivated, nor different values are checked in the original paper",BHqmQ6tnb3N
2752,2752,"Moreover, the authors claim that the method from their experiments is quite sensitive to this choice of hyperparameters",BHqmQ6tnb3N
2753,2753,"However, although claimed to conducted experiments on hyperparameter search, the authors only report results for tuning only 1 of the 3 main hyperparameters",BHqmQ6tnb3N
2754,2754,Even with these experiments the provided results do not seem to confirm the authors' claim on high sensitivity,BHqmQ6tnb3N
2755,2755,I may be missing something but the results of figures 4 and 5 look consistent enough for me,BHqmQ6tnb3N
2756,2756,Ablation Study: no ablation study has been conducted,BHqmQ6tnb3N
2757,2757,Discussion on results: the report does have this discussion and clearly states which parts of their reproducibility study was easy and difficult,BHqmQ6tnb3N
2758,2758,"However, some drawn conclusions by the authors are questionable",BHqmQ6tnb3N
2759,2759,"For example, the authors claim that from their experiments the model is highly sensitive to selection of hyperparameters",BHqmQ6tnb3N
2760,2760,"Considering that this is true (questionable on its own (see above)), then the authors claim that the model is not generalisable to a more difficult dataset, however, they do not report at all on hyperparameter selection for this dataset",BHqmQ6tnb3N
2761,2761,From this it might be the case that this is still the same issue of sensitivity to hyperparameters rather than the additional issue with generalisability,BHqmQ6tnb3N
2762,2762,Recommendations for reproducibility: are provided to some extent,BHqmQ6tnb3N
2763,2763,The main recommendation is considering the hyperparameter selection procedure,BHqmQ6tnb3N
2764,2764,Results beyond the paper: the authors go in several directions beyond the paper,BHqmQ6tnb3N
2765,2765,They explore different base classifiers that the proposed method from the original paper should explain and they test the model on a more difficult dataset,BHqmQ6tnb3N
2766,2766,Overall organisation and clarity: the report is mostly well written and easy to follow,BHqmQ6tnb3N
2767,2767,There are a number of minor typos,BHqmQ6tnb3N
2768,2768,Some specific points:,BHqmQ6tnb3N
2769,2769,"1.	Line 29, “parameter selection of the paper” – bad wording",BHqmQ6tnb3N
2770,2770,"2.	Line 47, DAG is not introduced",BHqmQ6tnb3N
2771,2771,"3.	Lines 118-119, “we introduce the following two variants” which follows only by one option",BHqmQ6tnb3N
2772,2772,"4.	Lines 135-136, “These values …” should better be placed for the sentence “As described in Section 2.1.3” as the method from Figure 1 only determines values for K, L, and lambda and not the number of samples N_alpha and N_beta",BHqmQ6tnb3N
2773,2773,5.	Figure 2 requires more explanation about set up of the experiment and what different colours mean,BHqmQ6tnb3N
2774,2774,6.	Section 4.3 – everything should be adjusted to 3 input channels at once and there is no need to compare results without doing so,BHqmQ6tnb3N
2775,2775,Minor:,BHqmQ6tnb3N
2776,2776,"1.	Line 10, “of the of the” – the second of the is redundant",BHqmQ6tnb3N
2777,2777,"2.	Line 83, “traditioanally” -> “traditionally”",BHqmQ6tnb3N
2778,2778,3.	Both “grayscale” and “greyscale” is used in the text,BHqmQ6tnb3N
2779,2779,It should be consistent,BHqmQ6tnb3N
2780,2780,"4.	Line 117, “i.e.” is redundant",BHqmQ6tnb3N
2781,2781,"5.	Line 123, “",BHqmQ6tnb3N
2782,2782,"Which” -> “, which”",BHqmQ6tnb3N
2783,2783,"6.	Line 186, “In this table becomes” -> “From this table it becomes”",BHqmQ6tnb3N
2784,2784,7.	Line 196 – missing full stop at the end of the sentence,BHqmQ6tnb3N
2785,2785,"8.	Line 202, “Posterior to redesigning” -> “After redesigning”",BHqmQ6tnb3N
2786,2786,"9.	Line 206, “Especially for the horses” – unfinished sentence",BHqmQ6tnb3N
2787,2787,"10.	Line 217, “A number” -> “a number”",BHqmQ6tnb3N
2788,2788,"11.	Line 240, “pragmatic” – it seems the authors meant something else",BHqmQ6tnb3N
2789,2789,"This paper aims to reproduce and examine the claims made in the ""Generative causal explanations of black box classifiers"" paper",BHqmQ6tnb3N
2790,2790,The authors approach this problem by examining three aspects of behavior of the proposed model:,BHqmQ6tnb3N
2791,2791,1,BHqmQ6tnb3N
2792,2792,Reproducibility of the results presented in the original paper,BHqmQ6tnb3N
2793,2793,2,BHqmQ6tnb3N
2794,2794,Sensitivity to alternative black box models,BHqmQ6tnb3N
2795,2795,3,BHqmQ6tnb3N
2796,2796,Sensitivity to the choice of hyperparameters,BHqmQ6tnb3N
2797,2797,The authors find positive evidence of (1),BHqmQ6tnb3N
2798,2798,"However, they find a decay in performance with more complex models and a lack of robustness with respect to the choice of hyperparameters",BHqmQ6tnb3N
2799,2799,"Overall, I felt this was a solid reproduction",BHqmQ6tnb3N
2800,2800,"On the positive side: the authors do well to push the proposed methodology outside of the aspects presented within the paper, and I found the findings to be informative",BHqmQ6tnb3N
2801,2801,"On the less positive side: (a) Ideally, I would have liked to seen at least a set of hypotheses summarizing the explanation of the degradation of performance",BHqmQ6tnb3N
2802,2802,"(b) Some of the writing could use a little more fleshing out, the descriptions in the beginning of the text are spars and make it difficult to have full context without having read the prior paper within a very short window",BHqmQ6tnb3N
2803,2803,  ,BHqmQ6tnb3N
2804,2804,"The authors of this report have tried to reproduce the results of the paper ""Generative causal explanations of black-box classifiers"" by O’Shaughnessy et.al",sacRaG5zt_m
2805,2805,They have written up a Reproducibility Summary which has all the required elements,sacRaG5zt_m
2806,2806,"The scope of reproducibility is well-defined, and the report is well-structured and well-written",sacRaG5zt_m
2807,2807,The authors have reportedly re-written major portions of the code themselves and have not contacted the original paper's authors,sacRaG5zt_m
2808,2808,They have shared the link to the new codebase in the report which seems to have sufficient documentation,sacRaG5zt_m
2809,2809,They have explained the idea in the original paper well in their Introduction,sacRaG5zt_m
2810,2810,"It is impressive that they have not just tried to reproduce the results in the original paper but have also tested the framework on the entire MNIST dataset and the CIFAR-10 dataset, and included a discussion on the results on these datasets",sacRaG5zt_m
2811,2811,They have even tried to find causal relationships in a low-performance classifier on the MNIST dataset to extend the usefulness of the explanatory framework,sacRaG5zt_m
2812,2812,"They rightly question the usefulness of the explanations as some of the latent factors cannot be easily interpreted, especially on complex data sets",sacRaG5zt_m
2813,2813,They also try to explain the scenarios when the framework doesn't work as expected in disentangling the causal and non-causal latent factors,sacRaG5zt_m
2814,2814,A few suggestions to improve the report:,sacRaG5zt_m
2815,2815,1,sacRaG5zt_m
2816,2816,The authors should include the range of hyperparameters that they have tried before landing on the ones that they have used.,sacRaG5zt_m
2817,2817,2,sacRaG5zt_m
2818,2818,The authors should include the training times and the hardware they have used,sacRaG5zt_m
2819,2819,3,sacRaG5zt_m
2820,2820,"The authors rightly mention that it was difficult to quantify the results and the judgment of the results was based more on intuition, subject to personal biases and interpretations",sacRaG5zt_m
2821,2821,Do they have suggestions on what kind of metrics can be employed here? Consulting with the original paper's authors may have led to some good discussions about this aspect and possibly some useful metrics,sacRaG5zt_m
2822,2822,"In all, this is an impressive reproducibility report",sacRaG5zt_m
2823,2823,The authors have done due diligence in attempting to reproduce the results and have gone beyond by experimenting on more data sets and models,sacRaG5zt_m
2824,2824,"The authors reproduced the results in the paper ""Generative causal explanations of black-box classifiers""",sacRaG5zt_m
2825,2825,"Though source codes are open-sourced by the original authors, they claimed difficulties of using the original codes and re-implemented most of the codes",sacRaG5zt_m
